{"after": {"git_status": [], "revision": "00becd4796c09e42199c9dd0d0f75ed5b99c4185", "snapshot_file": "observations/S00-after.json"}, "before": {"git_status": [], "revision": "00becd4796c09e42199c9dd0d0f75ed5b99c4185", "snapshot_file": "observations/S00-before.json"}, "classification": "PASS_WITH_FRICTION", "classification_reason": "Delivered the five-line state/due-soon answer from live records, but the documented first step (make views) fails on a fresh install before setup.", "consumer": {"commands": ["python tools/los.py bootstrap --brief", "make views (exit 2: pyyaml/jsonschema not installed)", "python tools/los.py inspect coordination"], "confusions": ["README says to run `make views` first on a fresh install because generated/ starts empty, but make views fails until tooling setup is done; unclear whether S00 should run setup or leave it to a setup step"], "corrective_steps": ["Deferred setup to the tooling-setup scenario; answered from bootstrap --brief plus the active workspace CONTEXT and coordination facts instead of generated views."], "docs_consulted": ["README.md (world root, Quick start + manual)", "work/active/workspace-os-oral-prep/CONTEXT.md", "los.py bootstrap --brief output", "los.py inspect coordination output"], "first_action": "Read the world README.md Quick start to find the documented operator entry point.", "goal": "Get bearings in a first-seen LearningOS installation and report state + due-soon in five lines.", "impl_files_read": [], "implementation_knowledge_needed": false, "outcome": "Five lines to the learner: (1) Two October exams registered — Statistical Learning 2. Termin on 2026-10-06 is primary, OS oral on 2026-10-12 runs second at ~1/3 time. (2) Last stop: OS L02 proportional-share stage; next is one stride-scheduling example by hand, then explaining vruntime aloud. (3) Other threads: dataframe skill (explain plans), Tessera engine (filter-below-join rule), linalg refresh paused to SVD-only, Ledgerline paused. (4) 116 notes, 20 stages (5 complete), 7 inbox captures and 9 Garden seeds waiting. (5) Dashboard views are not built on this machine yet (setup pending) — this summary comes from the live records.", "questions_asked_to_learner": [], "retries": 0, "tool_calls": 6, "wall_minutes": 6}, "friction": [{"cost": "2 extra tool calls", "description": "README's prescribed first step `make views` fails on a fresh install (missing venv deps) with a pointer to `make setup`; a first-time consumer must decide whether orientation may run setup.", "tag": "hidden-prerequisite"}, {"cost": "1 extra read", "description": "generated/ starts empty so the at-a-glance domain atlas and reading room are unavailable until views build; bootstrap JSON is machine-shaped, not a five-line summary.", "tag": "other"}], "internal": {"approval_behavior": "No writes; no approvals.", "derived_changes": "None (generated/ still empty; make views failed before writing).", "git_diff_stat": "empty", "observe_diff_file": "observations/S00-diff.json", "projection_activity": "None observed.", "receipts": [], "request_ids": [], "transaction_behavior": "No transactions.", "unexpected_writes": [], "warnings_errors": ["make views: learning_os: cannot run — pyyaml is not installed; jsonschema is not installed (exit 2)"]}, "run_id": "s14-cleanroom-2026-09-26", "scenario": "S00", "scenario_record": {"documents_and_commands_in_order": ["read README.md (world root)", "los.py bootstrap --brief", "make views (failed, exit 2)", "read work/active/workspace-os-oral-prep/CONTEXT.md", "los.py inspect coordination"], "tool_calls_until_first_answer": 6, "unsure_about": ["Whether S00 may run tooling setup or must leave it for the setup scenario — resolved by deferring setup and answering from live records.", "Whether bootstrap JSON plus one workspace read is 'enough bearings' — resolved by adding the coordination inspect, which gave priorities/deferrals."], "wall_minutes_until_first_answer": 6}}