{"after": {"git_status": ["M knowledge/notes/machine-learning/note-svm-kernel-trick.md", "M knowledge/notes/mathematics/note-kernel-density-estimation.md", "?? operations/transactions/"], "revision": "00becd4796c09e42199c9dd0d0f75ed5b99c4185", "snapshot_file": "observations/S14-after.json"}, "before": {"git_status": [], "revision": "00becd4796c09e42199c9dd0d0f75ed5b99c4185", "snapshot_file": "observations/S14-before.json"}, "classification": "PASS", "classification_reason": "Ambiguity resolved by clarifying before any write; cosmetic-only cross-links applied via guarded note.revise after diff approval; learner wording byte-identical.", "consumer": {"commands": ["git reset --hard + git clean -fd (fresh world)", "los search \"kernel\" (4 notes, 3+ meanings — confirmed ambiguity)", "los note-read note-svm-kernel-trick + note-kernel-density-estimation (full)", "raw-byte whitespace scan (no trailing ws/tabs; clean endings)", "los capabilities note.revise --json", "prepare revised files + diff (pure additions)", "2x (bootstrap --compact + seal + capability note.revise) — exit 0", "git diff (verify 4 insertions, 0 deletions)", "make views + make check (exit 0)"], "confusions": ["Both target notes were already cosmetically clean — resolved: the only honest 'tidy' is cross-linking the overloaded word (operator links; wording untouched)."], "corrective_steps": [], "docs_consulted": ["los capabilities note.revise --json", "OPERATOR.md (note.revise preserves ID/path/role)", "README (operator files, links, rebuilds views)"], "first_action": "Reset the world to fresh, then searched 'kernel' to scope the ambiguity before asking.", "goal": "Clarify an ambiguous cleanup request, then tidy only what was approved, without changing wording.", "impl_files_read": [], "implementation_knowledge_needed": false, "outcome": "Asked first (4 kernel notes found); learner narrowed to SVM + density-estimation, tidy-only. Applied one 'See also' cross-link line per note via two note.revise transactions after diff approval. All learner wording unchanged (4 insertions, 0 deletions).", "questions_asked_to_learner": ["Before any write: asked which notes 'kernels' means and what 'clean up' should change — reply: 'The SVM and density-estimation ones. Just make them tidy — don't change what I said.'", "Asked approval of the specific change — reply: 'Show me the diff first.'", "Showed the exact two-hunk diff and asked approval — reply: 'Yes, apply exactly that diff.'"], "retries": 0, "tool_calls": 11, "wall_minutes": 22}, "friction": [], "internal": {"approval_behavior": "Two operator-approval note.revise envelopes (fresh snapshot each; note-id revision guards at 0, accepted); approvals record the scripted diff approval (owner-authorized).", "derived_changes": "Views regenerated.", "git_diff_stat": "2 files changed, 4 insertions(+), 0 deletions.", "observe_diff_file": "observations/S14-diff.json", "projection_activity": "Two note revisions recorded.", "receipts": ["operations/transactions/transaction-20260926-034419-001.yaml", "operations/transactions/transaction-20260926-034420-001.yaml"], "request_ids": ["request-s14-s14-note-svm-kernel-trick-1", "request-s14-s14-note-kernel-density-estimation-1"], "transaction_behavior": "Two note.revise commits (full-file replacement with hash-bound bytes), neither replayed.", "unexpected_writes": [], "warnings_errors": []}, "run_id": "s14-cleanroom-2026-09-26", "scenario": "S14", "scenario_record": {"changes": [{"after": "...(workspace deferral).\\n\\nSee also: note-kernel-density-estimation (different meaning of 'kernel').\\n", "before": "...(workspace deferral).\\n", "note": "note-svm-kernel-trick", "receipt": "operations/transactions/transaction-20260926-034419-001.yaml"}, {"after": "...choosing the bin width.\\n\\nSee also: note-svm-kernel-trick (different meaning of 'kernel').\\n", "before": "...choosing the bin width.\\n", "note": "note-kernel-density-estimation", "receipt": "operations/transactions/transaction-20260926-034420-001.yaml"}], "clarifying_questions": [{"reply": "The SVM and density-estimation ones. Just make them tidy — don't change what I said.", "when": "before any note-body read or write, right after the title search showed 4 kernel notes"}, {"reply": "Show me the diff first.", "when": "after proposing the specific cross-link change, before any write"}, {"reply": "Yes, apply exactly that diff.", "when": "after showing the exact diff, before any write"}]}}