{"after": {"canonical_digest": "see observations/S26-after.json", "derived_digest": "see observations/S26-after.json", "git_status": ["?? operations/transactions/idempotency.yaml", "?? operations/transactions/revisions.yaml", "?? operations/transactions/transaction-20260926-095556-001.yaml", "?? work/inbox/20260926-095556-ask-tutor-about-lasso-subgradients.md"], "revision": "a62b39169269ba26e13b7fbda9e3ad56367b1ef9", "snapshot_file": "observations/S26-after.json"}, "before": {"canonical_digest": "see observations/S26-before.json", "derived_digest": "see observations/S26-before.json", "git_status": [], "revision": "a62b39169269ba26e13b7fbda9e3ad56367b1ef9", "snapshot_file": "observations/S26-before.json"}, "classification": "PASS", "classification_reason": "All three goals completed with no failed commands, no retries, no new doc reads.", "consumer": {"commands": ["bootstrap --brief", "inspect module-tuh-statlearn", "capabilities capture.create --json", "seal + capability capture.create --payload-file (COMMIT transaction-20260926-095556-001)", "search caching --type note", "note-read note-caching-everywhere", "search caching --type note --content + git status"], "confusions": [], "corrective_steps": [], "docs_consulted": [], "first_action": "bootstrap --brief for deadlines", "goal": "S26: (1) due in 3 weeks, (2) inbox note, (3) caching notes", "implementation_knowledge_needed": false, "impl_files_read": [], "outcome": "(1) StatLearn 2. Termin 2026-10-06 10:00-12:00 registered (in window on any frame); OS oral 2026-10-12 14:30 registered (in window from 09-26). (2) Captured 'ask tutor about lasso subgradients' to work/inbox/20260926-095556-ask-tutor-about-lasso-subgradients.md, receipt transaction-20260926-095556-001. (3) Showed the one caching note: note-caching-everywhere (The same cache idea in three courses).", "questions_asked_to_learner": ["Proposed: capture 'ask tutor about lasso subgradients' to your inbox. OK? -> Yes."], "retries": 0, "tool_calls": 7, "wall_minutes": 1.3}, "internal": {"approval_behavior": "operator-approval with intent hash; learner approval via scripted Yes", "derived_changes": "snapshot sha256:5e09.. -> 5d6c..", "git_diff_stat": "4 untracked files (inbox note, receipt, ledger, idempotency); no modifications", "manifest_changes": "snapshot advanced once", "observe_diff_file": "observations/S26-diff.json", "persistence_activity": "1 inbox file created", "projection_activity": "reads served fresh post-capture (note search sees new snapshot)", "receipts": ["operations/transactions/transaction-20260926-095556-001.yaml"], "request_ids": ["request-s09b-p1-s26-capture-01"], "transaction_behavior": "1 commit (replayed=false), no refusals", "unexpected_writes": [], "warnings_errors": []}, "run_id": "s09b-pass1-2026-09-26", "scenario": "S26", "scenario_record": {"first_correct_route_at": "2026-09-26T07:55:14Z", "goals": [{"answer": "StatLearn 2. Termin 2026-10-06 (registered); OS oral 2026-10-12 (registered); frame stated explicitly", "calls": 2, "docs": 0, "goal": "due-dates", "impl_reads": 0, "retries": 0, "seconds": 37}, {"answer": "captured to work/inbox/20260926-095556-ask-tutor-about-lasso-subgradients.md", "calls": 2, "docs": 0, "goal": "inbox-capture", "impl_reads": 0, "retries": 0, "seconds": 25}, {"answer": "note-caching-everywhere shown in full; content search confirms it is the only one", "calls": 3, "docs": 0, "goal": "caching-notes", "impl_reads": 0, "retries": 0, "seconds": 18}], "scenario_ended": "2026-09-26T07:56:14Z", "scenario_started": "2026-09-26T07:54:54Z"}, "uncertainties": ["Envelope recipe was carried from S10 earlier in this pass; a standalone S26 run would pay the S10 discovery cost first.", "'Next three weeks' frame is ambiguous (world as_of 2026-09-18 vs session date); answered with both dates and an explicit frame."]}