{
  "scenario": "S27",
  "run_id": "s05-connections-a-2026-09-25",
  "classification": "PASS_WITH_FRICTION",
  "classification_reason": "All 30 arrivals got a before-shelving connection list (176 results; A24 correctly empty) and the world is unchanged: observe.py diff shows 0 canonical changes, 0 receipts, the same HEAD and a clean git status. No product command accepts external text or a file to find related material, so every candidate set comes from search terms the operator chose, concept hits followed with `related`, and content search. material-context searches only material-analysis notes (none exist here) and no AI action covers connection discovery. 75 of 176 results, including every inbox duplicate, Garden seed and stage the drafts belong to, came from reading.",
  "before": {
    "revision": "13ad2fcaa0e478afddba6451e29376ca00f0bc8e",
    "git_status": [],
    "canonical_digest": "14a86016b0d4b1d3d9eca37a376708a01c108da6f039769ff19eb5d08326d2ec",
    "derived_digest": "df97c8737d287c93f8e3a048d46ad71f9da0e95cf3cccd0c0bbc8e63032db409",
    "snapshot_file": "observations/S27-before.json"
  },
  "consumer": {
    "goal": "Before anything is filed: for each capture A01–A30 in eval-drop/, tell the learner what she already has that it connects to, best first, and why; change nothing.",
    "first_action": "Read eval-drop/index.json and all 30 arrival files (outside the installation).",
    "commands": [
      "python tools/los.py material-context --help; ai-action-list --help; capture --help; note-analysis-prepare --help",
      "python tools/los.py ai-action-list (garden.shelve, unit.compare-materials only)",
      "python tools/los.py material-context \"Bayesian network\"; material-context \"naive bayes\" (both empty: pool has 0 analysis notes)",
      "per arrival (193 calls total): search \"<2–3 operator-chosen terms>\"; related CONCEPT for each concept the searches returned (max 6); search \"<2 terms>\" --type note --content  — per-arrival list in connections.jsonl `commands`, every call in evidence/S27-cli-calls.log"
    ],
    "tool_calls": 10,
    "docs_consulted": [
      "system/OPERATOR.md (capture routing, shelving approval; read in S03)",
      "los --help"
    ],
    "impl_files_read": [],
    "retries": 0,
    "confusions": [
      "Nothing in OPERATOR.md or CLAUDE.md describes finding connections for material that is not yet in the repository; shelving (shelving-prepare) works on stage notes and the Garden, and capture routing is left to the operator.",
      "material-context sounded like 'find related saved material' but searches only material-analysis notes and assessments; its empty answer says so honestly ('never proves no source explains the topic')."
    ],
    "corrective_steps": [
      "Extracted 2–3 search terms per arrival by reading it, followed concept hits with `related`, and added content search.",
      "Used my S03 reading of the identical world (same HEAD 13ad2fc) for the notes, Garden, inbox and stage texts; re-reading them in the fresh world would give the same bytes."
    ],
    "questions_asked_to_learner": [],
    "implementation_knowledge_needed": false,
    "wall_minutes": 6.2,
    "outcome": "Thirty per-capture lists (0–9 items) with reasons and quotes. Duplicates are flagged: A29 = inbox DRF link, A11 ≈ corrected p-value note + inbox reminder, A18 = Garden DAG seed. A27 is flagged as outdating her 'hash join is always O(n+m)' summary. Stage drafts (A02, A14, A20, A27) are pointed at the stages they belong to. A24 (sourdough) connects to nothing. Nothing was changed."
  },
  "internal": {
    "request_ids": [],
    "receipts": [],
    "transaction_behavior": "None: read-only commands only; no --help invocation of capture/note-analysis-prepare wrote anything.",
    "approval_behavior": "None required. The learner said 'don't change anything yet', and nothing was proposed.",
    "projection_activity": "As in S03, the first reads materialised generated/derived-state (git-ignored).",
    "persistence_activity": "Derived only: 118 files, 490,130 bytes, same digest as S03's (deterministic).",
    "derived_changes": "generated/derived-state: 0 → 490,130 bytes; derived digest df97c873… → 28a681fe….",
    "manifest_changes": "none",
    "unexpected_writes": [],
    "warnings_errors": [],
    "git_diff_stat": "",
    "observe_diff_file": "observations/S27-diff.json"
  },
  "after": {
    "revision": "13ad2fcaa0e478afddba6451e29376ca00f0bc8e",
    "git_status": [],
    "canonical_digest": "14a86016b0d4b1d3d9eca37a376708a01c108da6f039769ff19eb5d08326d2ec",
    "derived_digest": "28a681fe6a6e6949e8f7d5f57f92cea8e7b220af26a67e82b821d281f76fdd3c",
    "snapshot_file": "observations/S27-after.json"
  },
  "friction": [
    {
      "tag": "missing-capability",
      "description": "No read takes an arbitrary text or file (an arrival) and returns related material; the operator has to translate each capture into search terms by hand.",
      "cost": "193 CLI calls for 30 arrivals"
    },
    {
      "tag": "missing-capability",
      "description": "Inbox captures and Garden seeds are invisible to search, so obvious duplicates (A29 vs inbox:20260816-drf-paper-link.md, A18 vs garden:everything-is-a-dag.md) can only be found by reading.",
      "cost": "direct reads of 16 files (from S03)"
    },
    {
      "tag": "other",
      "description": "Substring search returns keyword decoys: 'CAP' matches the simulated-annealing note ('escape'), 'running' matches deadlock/idempotency notes, 'explain' matches project-ledgerline.",
      "cost": "manual filtering"
    },
    {
      "tag": "unclear-terminology",
      "description": "material-context ('find saved explanations by need') is about material analyses, not the learner's notes; the name suggests broader retrieval.",
      "cost": "3 calls"
    }
  ],
  "failures": [
    "F-s05-garden-inbox-unreachable-01"
  ],
  "scenario_record": {
    "connection_records": "connections.jsonl, 30 lines with phase \"before-shelving\" (A01–A30)",
    "which_product_commands_produced_candidates": {
      "summary": "176 results: 67 product:related (search → concept → related), 24 product:search, 10 product:search-content, 75 agent-reading. Among ranks 1–3: 59 product, 28 reading. At rank 1: 19 product, 10 reading.",
      "per_probe_product_share": "A01 4/9, A02 4/7, A03 6/9, A04 3/8, A05 4/7, A06 4/8, A07 3/6, A08 6/7, A09 5/7, A10 2/7, A11 3/5, A12 2/4, A13 3/3, A14 3/8, A15 2/4, A16 3/7, A17 3/3, A18 6/9, A19 2/3, A20 4/8, A21 7/9, A22 3/4, A23 5/7, A24 0/0, A25 3/5, A26 4/6, A27 2/6, A28 2/3, A29 2/3, A30 1/4",
      "raw_candidate_sets": "evidence/S27-product-candidates.json"
    },
    "which_candidates_added_by_reading": "All 13 stage, 11 Garden, 9 inbox and 7 sibling-arrival results, plus 33 notes and 2 workspaces. Examples: A29 → the identical inbox DRF link; A03 → the inbox Tessera todo it ticks off; A21's slide → the paused PCA↔SVD stage it answers; A25 → the MLE-coin and Gaussian-noise derivations (cross-entropy and squared error as likelihoods); A12 → dynamic programming.",
    "world_unchanged": "observe.py diff S27-before → S27-after: canonical added/removed/modified 0/0/0, canonical_digest_changed false, receipts_added 0, inflight 0, new_operations 0, HEAD 13ad2fc both sides, git status empty. eval-drop/ is byte-identical to the S03 world's drop (sha256 over all 31 files matches). The only change is the git-ignored derived-state cache. Four read-only verification reads (evidence/F01–F03) ran against this world after the S27-after snapshot; a final git status check is in the session report."
  },
  "uncertainties": [
    "Sibling-arrival targets (7) are not 'what she already has'; I listed them last so they get filed together. A scorer that reads the learner's words strictly may ignore them.",
    "Knowledge of note contents came from S03's reading of an identical world rather than fresh reads in the S27 world."
  ]
}